[
  {
    "device": "/dev/sda",
    "model": "ST9250320AS",
    "type": "HDD",
    "size_gib": 232.9,
    "smart_available": true,
    "overall_health": "PASSED",
    "overall_verdict": "CAUTION",
    "critical_findings": [
      "Spin_Retry_Count = 11 (ID 10)",
      "Command_Timeout = 1 (ID 188)"
    ],
    "info": {
      "Power_On_Hours": "2227",
      "Airflow_Temperature_Cel": "40",
      "Temperature_Celsius": "40"
    },
    "raw_smart": {
      "1": {
        "name": "Raw_Read_Error_Rate",
        "value": 115,
        "worst": 99,
        "thresh": 6,
        "raw": "99115304"
      },
      "3": {
        "name": "Spin_Up_Time",
        "value": 99,
        "worst": 98,
        "thresh": 0,
        "raw": "0"
      },
      "4": {
        "name": "Start_Stop_Count",
        "value": 97,
        "worst": 97,
        "thresh": 20,
        "raw": "3328"
      },
      "5": {
        "name": "Reallocated_Sector_Ct",
        "value": 100,
        "worst": 100,
        "thresh": 36,
        "raw": "0"
      },
      "7": {
        "name": "Seek_Error_Rate",
        "value": 81,
        "worst": 60,
        "thresh": 30,
        "raw": "157526721"
      },
      "9": {
        "name": "Power_On_Hours",
        "value": 98,
        "worst": 98,
        "thresh": 0,
        "raw": "2227"
      },
      "10": {
        "name": "Spin_Retry_Count",
        "value": 100,
        "worst": 100,
        "thresh": 97,
        "raw": "11"
      },
      "12": {
        "name": "Power_Cycle_Count",
        "value": 97,
        "worst": 97,
        "thresh": 20,
        "raw": "3284"
      },
      "184": {
        "name": "End-to-End_Error",
        "value": 100,
        "worst": 100,
        "thresh": 99,
        "raw": "0"
      },
      "187": {
        "name": "Reported_Uncorrect",
        "value": 100,
        "worst": 100,
        "thresh": 0,
        "raw": "0"
      },
      "188": {
        "name": "Command_Timeout",
        "value": 100,
        "worst": 100,
        "thresh": 0,
        "raw": "1"
      },
      "189": {
        "name": "High_Fly_Writes",
        "value": 100,
        "worst": 100,
        "thresh": 0,
        "raw": "0"
      },
      "190": {
        "name": "Airflow_Temperature_Cel",
        "value": 60,
        "worst": 51,
        "thresh": 45,
        "raw": "40"
      },
      "191": {
        "name": "G-Sense_Error_Rate",
        "value": 100,
        "worst": 100,
        "thresh": 0,
        "raw": "842"
      },
      "192": {
        "name": "Power-Off_Retract_Count",
        "value": 99,
        "worst": 99,
        "thresh": 0,
        "raw": "3207"
      },
      "193": {
        "name": "Load_Cycle_Count",
        "value": 100,
        "worst": 100,
        "thresh": 0,
        "raw": "1909"
      },
      "194": {
        "name": "Temperature_Celsius",
        "value": 40,
        "worst": 49,
        "thresh": 0,
        "raw": "40"
      },
      "195": {
        "name": "Hardware_ECC_Recovered",
        "value": 53,
        "worst": 34,
        "thresh": 0,
        "raw": "99115304"
      },
      "197": {
        "name": "Current_Pending_Sector",
        "value": 100,
        "worst": 100,
        "thresh": 0,
        "raw": "0"
      },
      "198": {
        "name": "Offline_Uncorrectable",
        "value": 100,
        "worst": 100,
        "thresh": 0,
        "raw": "0"
      },
      "199": {
        "name": "UDMA_CRC_Error_Count",
        "value": 200,
        "worst": 200,
        "thresh": 0,
        "raw": "0"
      }
    },
    "recommendation": "Drive shows warning signs. Plan a clone soon and monitor closely.",
    "clone_urgency": "soon"
  },
  {
    "device": "/dev/sdb",
    "model": "OnlyDisk",
    "type": "HDD",
    "size_gib": 29.0,
    "smart_available": true,
    "overall_health": "unknown",
    "overall_verdict": "unknown",
    "critical_findings": [],
    "info": {},
    "raw_smart": {},
    "recommendation": "SMART data unavailable or inconclusive.",
    "clone_urgency": "none",
    "note": "Removable device \u2014 SMART data may be unavailable or unreliable."
  },
  {
    "device": "/dev/sdc",
    "model": "OnlyDisk",
    "type": "HDD",
    "size_gib": 29.0,
    "smart_available": true,
    "overall_health": "unknown",
    "overall_verdict": "unknown",
    "critical_findings": [],
    "info": {},
    "raw_smart": {},
    "recommendation": "SMART data unavailable or inconclusive.",
    "clone_urgency": "none",
    "note": "Removable device \u2014 SMART data may be unavailable or unreliable."
  }
]